id	date	title	url
271833	2023-06-27	Підлітків у Бердянську застрелили снайпери: правозахисники розкрили деталі злочину	https://nikvesti.com/news/271833
271847	2023-06-27	Розпочалася повторна перевірка, — в Миколаївській ОВА розповіли про ситуацію з укриттями по області	https://nikvesti.com/news/271847
272552	2023-07-11	«Гога, він же Гоша,  Валєра, Гоня», — Кім назвав першого заступника Решетілова «своїм Єрмаком»	https://nikvesti.com/news/272552
272631	2023-07-12	«Він взяв цивільний напрямок оборони, а я військовий», — Марченко пояснив, як став для Кіма «своїм Залужним»	https://nikvesti.com/news/272631
272802	2023-07-15	«Оборона Миколаєва — одна з найстратегічніших перемог у цій війні», — полковник СБУ Костенко	https://nikvesti.com/news/272802
272968	2023-07-19	Генерал-майору Марченку, який керував обороною Миколаєва, благодійники передали безпілотники	https://nikvesti.com/news/272968
273173	2023-07-22	Миколаївський спортсмен отримає ₴100 тис. за визначні досягнення	https://nikvesti.com/news/273173
273664	2023-07-31	На Миколаївщині відбувся кінний чемпіонат для дітей та дорослих	https://nikvesti.com/news/273664
275184	2023-08-29	У Миколаєві вшанували памʼять полеглих захисників, що загинули в боротьбі за незалежність України	https://nikvesti.com/news/275184
275220	2023-08-30	На Миколаївщині пройшов шаховий турнір «Інгульські мости»	https://nikvesti.com/news/275220
275600	2023-09-05	Благодійник передали миколаївським захисникам бронежилети та квадракоптер	https://nikvesti.com/news/275600
275870	2023-09-09	У Миколаєві до Дня міста відбувся чемпіонат Кубку мера з футболу: його присвятили ЗСУ	https://nikvesti.com/news/275870
277019	2023-09-29	У Миколаєві відбувся відкритий чемпіонат області з художньої гімнастики	https://nikvesti.com/news/277019
277358	2023-10-05	Перспективи відновлення зрошення на Миколаївщині: відбулась робоча зустріч з питань діяльності ОВК «Інгулецька»	https://nikvesti.com/news/277358
277361	2023-10-05	При Миколаївський ОВА створять робочу групу «Прозорість та відкритість»	https://nikvesti.com/news/277361
278508	2023-10-27	У миколаївському парку Перемоги висадили молоді сосни	https://nikvesti.com/news/278508
279229	2023-11-09	У Миколаївській ОВА відзвітували про результати діяльності робочої групи «Прозорість та відкритість»	https://nikvesti.com/news/279229
281603	2023-12-24	На Миколаївщині заміновано 30% території, — ОВА	https://nikvesti.com/news/281603
281797	2023-12-28	Зміна секретаря Южноукраїнської міськради була законною, — Кім	https://nikvesti.com/news/281797
281799	2023-12-28	Нардеп Чорноморов не згоден з оцінкою Кіма по імпічменту в Южноукраїнську: «Це рейдерське захоплення влади в місті»	https://nikvesti.com/news/281799
281814	2023-12-28	Цьогоріч Миколаївщина експортувала 2,3 мільйона тонн зернових	https://nikvesti.com/news/281814
282145	2024-01-05	Миколаївців попередили про можливе обмеження руху на дорогах через негоду	https://nikvesti.com/news/282145
282147	2024-01-05	Сєнкевич: комунальники Миколаєва готові до негоди	https://nikvesti.com/news/282147
282213	2024-01-07	Погіршення погодних умов: поліція Миколаївщини закликає водіїв відмовитись від поїздок	https://nikvesti.com/news/282213
282216	2024-01-07	Водіїв попередили, що через негоду можуть перекрити проїзд двома трасами на Миколаївщині	https://nikvesti.com/news/282216
282230	2024-01-08	Негода на Миколаївщині: 54 населених пункти в області залишились без електроенергії	https://nikvesti.com/news/282230
282234	2024-01-08	Повалені дерева та аварії: ситуація на дорогах Миколаївщини ускладнилась, ДСНС ліквідують наслідки негоди	https://nikvesti.com/news/282234
282258	2024-01-08	Майже 70 тис. родин залишились без світла через негоду на Миколаївщині	https://nikvesti.com/news/282258
282272	2024-01-08	Погіршення погоди: миколаївські комунальники вийшли на обробку доріг міста	https://nikvesti.com/news/282272
282403	2024-01-10	Посилення вітру, мокрий сніг та ожеледиця: в Україні оголосили жовтий рівень небезпеки	https://nikvesti.com/news/282403
284723	2024-02-21	У трьох медзакладах Миколаєва працює нове обладнання для новонароджених дітей	https://nikvesti.com/news/nove-obladnannya-dlya-novonarodzhenikh-ditei-v-mykolaievi-ua
284735	2024-02-21	Миколаївському пологовому будинку №3 передали нове медичне обладнання для недоношених дітей	https://nikvesti.com/news/мikolaivskomu-pologovomu-budynku-n3-novе-medichne-obladnannia
286682	2024-04-01	Котедж у Коблевому та ₴4 млн спадщини: що в деклараціях заступників Кіма за 2023 рік	https://nikvesti.com/news/deklaratsii-zastupnikiv-mykolaivskoi-ova-2023-novi-kvartiri-ta-spadok-ua
287504	2024-04-18	Сапери розмінували вже 211 тисяч гектарів Миколаївщини, — ОВА	https://nikvesti.com/news/rozmіnuvannya-mykolayivsʹkoyi-oblasti-stan-na-kviten-2024-roku_ua
289017	2024-05-18	У центрі Миколаєва стартував масштабний забіг: долучились близько 500 учасників	https://nikvesti.com/news/u-tsentri-mykolaieva-startuvav-masshtabnii-zabih-2024
289490	2024-05-28	Миколаївщина отримала понад тисячі одиниць побутової техніки — їх передали школам та дитбудинкам	https://nikvesti.com/news/mykolaivshchyna-otrimala-ponad-tysyachi-odynyc-pobutovoyi-tekhniki-shkoly-dytbudynky
289682	2024-06-01	Чому фермери Миколаївщини продовжують працювати, незважаючи на мінну небезпеку	https://nikvesti.com/news/chomu-fermeri-mykolaivshchyny-prodovzhuiut-pratsiuvaty-nezvazhaiuchi-na-minnu-nebezpeku-ua
291124	2024-06-28	Зеленський дав звання «Заслуженого юриста України» першому заступнику Кіма	https://nikvesti.com/news/volodymyr-zelenskyy-nahorodyv-georgiya-reshetilova-zvannyam-zasluzhenyy-yuryst-za-vahomyy-vnesok-u-zahyst
294932	2024-09-19	Влада Херсонщини обіцяє розмінувати правобережжя до кінця 2025 року	https://nikvesti.com/news/294932-vlada-khersonshchyny-obitsiaie-rozminuvaty-pravoberezhzhia-do-kintsia-2025-roku
295490	2024-10-02	«Миколаївщина пишається вами!»: Віталій Кім зустрівся з паралімпійцями та їхніми наставниками	https://nikvesti.com/news/295490-vitaliy-kim-paralimpiyci-naavstavnyky
295489	2024-10-02	Антон Табунщик: Паралімпійці Миколаївщини — гордість нашої області	https://nikvesti.com/news/295489-anton-tabunshchik-paralimpiitsi-mykolaivshchyny-gordist-nashoi-oblasti
295527	2024-10-03	На правобережній Херсонщині розмінували 55% територій, — ОВА	https://nikvesti.com/news/295527-na-pravoberezhnyi-khersonshchyni-rozminuvali-55-teritorii-ova
295642	2024-10-07	У Миколаєві відбулась нарада з користувачами мисливських угідь	https://nikvesti.com/news/295642-narada-z-korystuvachamy-mislivskikh-ugid-u-mykolayevi
295850	2024-10-11	Цьогоріч сапери розмінували 14 тисяч гектар сільгоспземель на Миколаївщині: ними вже можуть користуватися аграрії	https://nikvesti.com/news/295850-saperi-rozminuvali-14-tisyach-gektar-silgospszemel-na-mykolaivschyni
295869	2024-10-11	«М86». У Миколаєві відкрили виставку, присвячену обороні Маріуполя	https://nikvesti.com/news/295869-u-mikolaevi-vidkrili-vistavku-prisvyachenu-oboron-mariupolya
296145	2024-10-17	На правобережній Херсонщині розмінували 57% територій, — ОВА	https://nikvesti.com/news/296145-na-pravoberezhnij-khersonshchini-rozminuvali-57-teritorij-ova
296174	2024-10-18	У парку Миколаєва знайшли касетний боєприпас, який пролежав там декілька років	https://nikvesti.com/news/296174-u-mikolayevi-znayshli-kasetniy-boyepripas
296310	2024-10-22	«Нібулон» використовуватиме ШІ при розмінуванні Миколаївщини	https://nikvesti.com/news/296310-nibulon-implements-shi-for-demining
296427	2024-10-24	На правобережній Херсонщині розмінували 57,4% територій, — ОВА	https://nikvesti.com/news/296427-na-pravoberezhnij-khersonshchini-rozminuvali-57-4-teritorij
296547	2024-10-28	Понад 26 тисяч боєприпасів знищили піротехніки ДСНС у Миколаївській області	https://nikvesti.com/news/296547-na-mykolaivshchyni-znyschyly-ponad-26-tysiach-boyeprypasiv-onovlennya-pro-rozminuvannya
296751	2024-10-31	На правобережній Херсонщині розмінували 58% територій, — ОВА	https://nikvesti.com/news/296751-na-pravoberezhnij-khersonshchini-rozminuvali-58-teritorii-ova
297378	2024-11-14	На правобережній Херсонщині розмінували 60% територій, — ОВА	https://nikvesti.com/news/297378-na-pravoberezhniy-khersonshchini-rozminuvali-60-teritoriy-ova
297698	2024-11-21	У Миколаївській обласній клінічній лікарні відкрили сучасне реабілітаційне відділення	https://nikvesti.com/news/297698-u-oblasnii-klinichnii-likarnii-vidkrili-nove-suchasne-reabilitatsiine-viddilennia
297712	2024-11-21	ОВА: на правобережній Херсонщині розмінували понад 60% територій	https://nikvesti.com/news/297712-ova-na-pravoberezhnij-khersonshchini-rozminuvali-ponad-60-territoriy
298046	2024-11-28	На правобережній Херсонщині розмінували майже 62% територій, — ОВА	https://nikvesti.com/news/298046-na-pravoberezhnij-khersonshchini-rozminuvali-majzhe-62-teritorij-ova
298396	2024-12-06	«До кінця року встигнемо», — в ОВА повідомили, що майже виконали план по розмінуванню Миколаївщини у 2024 році	https://nikvesti.com/news/298396-do-kintsya-roku-vstignemo-v-ova-povidomili-shcho-mayzhe-vykonaly-plan-po-rozminuvannyu-mykolaivshchyny-u-2024-rotsi
298479	2024-12-08	«Багато залежить від сил і засобів», — сапери обстежили вже більше третини потенційно замінованих земель Миколаївщини	https://nikvesti.com/news/298479-saperi-obstezhili-bilshe-tretini-zaminovanikh-zemel-mykolaivshchini
298688	2024-12-12	За останній тиждень сапери розмінували понад 700 гектарів правобережної Херсонщини	https://nikvesti.com/news/298688-saperi-rozminuvali-740-gektariv-hersonshchini
298824	2024-12-16	Піротехніки знищили у Миколаївській області понад 27 тисяч боєприпасів	https://nikvesti.com/news/298824-pirotekhniki-znyshchyly-ponad-27-tisyach-boieprypasiv-v-mykolayivskiy-oblasti
299012	2024-12-19	На правобережній Херсонщині розмінували 62% територій	https://nikvesti.com/news/299012-na-pravoberezhnyi-khersonshchyni-rozminuvali-62-teritorii-ova
299057	2024-12-20	У Миколаєві для дітей провели захід із протимінної безпеки	https://nikvesti.com/news/299057-u-mikolaievi-dlya-ditei-provely-zahid-iz-protiminnoi-bezpeki
299485	2024-12-31	Кім розказав про підтримку миколаївського баскетболу та плани виходу у Суперлігу	https://nikvesti.com/news/299485-kim-rozkazav-pro-pidtrymku-mykolaivskogo-basketbolu-ta-plany-vykhodu-u-superlihu-2024
299498	2024-12-31	За рік сапери розмінували понад 250 тис. га на правобережжі Херсонщини	https://nikvesti.com/news/299498-saperi-rozminuvaly-257-tysiach-gektariv-na-pravoberezhzhi-khersonshchyny-u-2024-rotsi
299705	2025-01-08	Піротехніки знищили мінометну міну знайдену поблизу села на Миколаївщині	https://nikvesti.com/news/299705-pyrotekhniki-znyshchyly-na-mykolaivshchyni-minu-znaydenu-poblyzu-sela
299728	2025-01-08	В Україні у 2024 році при розмінуванні вилучили 133 тисячі мін та снарядів	https://nikvesti.com/news/299728-ukraine-land-de-mined-2024
299801	2025-01-09	На правобережній Херсонщині розмінували 62,5% територій, — ОВА	https://nikvesti.com/news/299801-na-pravoberezhniy-khersonshchini-rozminuvali-625-teritoriy-ova
300102	2025-01-16	На правобережній Херсонщині розмінували 63% територій	https://nikvesti.com/news/300102-na-pravoberezhnii-khersonshchini-rozminuvali-63-teritorii-ova
300302	2025-01-21	На правобережжі Херсонщини розміновано понад 400 тис. га територій	https://nikvesti.com/news/300302-na-pravoberezhzhi-khersonshchini-rozminovano-ponad-400-tis-ha-teritoriy
300411	2025-01-24	У Миколаєві школярам розповіли про мінну безпеку	https://nikvesti.com/news/300411-u-mikolaievi-shkoliariv-navchali-pravil-minnoi-bezpeki
300656	2025-01-29	Зустріч з аграріями та підписання меморандуму з ФАО: Миколаївщину відвідав очільник Мінагро	https://nikvesti.com/news/300656-mykolaivshchinu-2024-visit-minagro
300781	2025-02-01	На Полтавщині зафіксовано землетрус магнітудою 3,8	https://nikvesti.com/news/300781-vecheri-1-lyutogo-v-poltavskiy-oblasti-stavsya-zemletrus-magnitudoyu
301423	2025-02-16	На Полтавщині стався землетрус	https://nikvesti.com/news/301423-na-poltavshchyni-zemletrus
301641	2025-02-20	На правобережній Херсонщині розмінували вже понад 64% території	https://nikvesti.com/news/301641-na-pravoberezhnii-khersonshchini-rozminuvali-vzhe-ponad-64-teritorii
302008	2025-02-28	На правобережній Херсонщині за тиждень сапери вилучили 558 вибухових предметів	https://nikvesti.com/news/302008-na-pravoberezhnyi-khersonshchyni-saperi-vy-luchyly-558-vybukhovykh-predmetiv
302024	2025-03-01	У Миколаєві відбувся обласний турнір з боксу серед юнаків, юніорів та молоді	https://nikvesti.com/news/302024-turnir-z-boksu-sered-sportsmeniv-mykolaivskoi-oblasti-ua
302246	2025-03-06	На правобережній Херсонщині розмінували майже 65% територій	https://nikvesti.com/news/302246-na-pravoberezhnyi-khersonshchyni-rozminuvaly-maizhe-65-teritorii
303354	2025-04-03	Зарплати по ₴100 тис. на місяць: що задекларували заступники голови Миколаївської ОВА за 2024 рік	https://nikvesti.com/news/303354-zastupnyky-holovy-mykolaivskoi-oblasnoi-viiskovoi-administratsii-deklaratsii-2024
303969	2025-04-17	У Снігурівці знищать вибухонебезпечний предмет, знайдений біля будинку культури	https://nikvesti.com/news/303969-viavleno-vibukhonebezpechnyi-predmet-u-snigurivtsi-shcho-pro-tse-vidomo
304009	2025-04-18	Разом переможемо: на Миколаївщині відбувся IV обласний етап Всеукраїнського фізкультурно-оздоровчого заходу «Пліч-о-пліч Всеукраїнські шкільні ліги» з волейболу	https://nikvesti.com/news/304009-plich-o-plich-vseukrainska-shkilna-liga-turnir-voleibolu-na-mykolaivshchini
304522	2025-05-02	«Ніко-Баскет» переходить до Суперліги: гравців та тренерів відзначили преміями	https://nikvesti.com/news/304522-basketbolna-komanda-niko-basket-perekhodyt-do-superligyvyshchogo-divizionu-2024
305281	2025-05-23	«Енергія майбутнього»: у Могилянці навчають студентів про відновлювану енергетику	https://nikvesti.com/news/305281-energiya-maybutnogo-u-mogylyantsi-navchayut-studentiv-pro-vidnovlyuvanu-energetiku
306769	2025-07-03	Відбулося засідання 30-ої сесії Миколаївської обласної ради	https://nikvesti.com/news/306769-rezultaty-30-y-sesii-mykolaivskoi-oblradi-novi-ustanovy-ta-zminy-u-komisiiah
309278	2025-09-19	Зеленський підписав указ про створення Офісу військового омбудсмена	https://nikvesti.com/news/309278-zelensky-pidpisav-ukaz-pro-stvorennia-ofisu-viiskovogo-ombudsmana
310093	2025-10-16	Ольга Решетилова стала військовим омбудсманом в Україні	https://nikvesti.com/news/310093-olga-reshetilova-pryznachena-na-posadu-viiskovogo-ombudsmana
310997	2025-11-11	Військова омбудсманка Решетилова: Якщо ви досі не оновили дані в ТЦК — ви безвідповідальна людина	https://nikvesti.com/news/310997-vijskova-ombudsmanka-reshetilova-rozkritikuvala-gromadyan-yaki-ne-onovili-dani-v-tck
312564	2025-12-22	Поліція шукає свідків можливого поранення під час полювання на Миколаївщині: Чи були там депутати та посадовці?	https://nikvesti.com/news/312564-politsiia-shukae-svidkiv-mozlyvoho-poranennia-pid-chas-poluvannia-na-mykolaivshchyni-chi-buly-tam-deputaty-ta-posad
312583	2025-12-23	«Йшов, послизнувся і впав, проштрикнувши стегно», — депутат Андрєєв пояснив своє поранення на полюванні	https://nikvesti.com/news/312583-poyasnenya-deputata-andriyeva-pro-poranennya-na-polyuvanni
312671	2025-12-25	У Кіма не бачать підстав для введення військової адміністрації у Південноукраїнську, де депутати тричі не зібрались й не прийняли бюджет 2026	https://nikvesti.com/news/312671-kim-vidreaguvav-na-prokhannya-vvesti-viiskovu-administratsiyu-v-pivdennoukrayinsku
312728	2025-12-26	За 2 роки після конфіскації Миколаївського глиноземного заводу Фонд держмайна нічого не зробив, щоб вирішити екологічну проблему зі шламом	https://nikvesti.com/news/312728-za-2-roky-pislya-konfiskatsii-mykolaivskogo-hlynozemnogo-zavodu-fond-derzhmaina-lichoho-ne-zrobyv-shchob-vyrish
314822	2026-02-11	На Миколаївщині відбулося чергове засідання Координаційного штабу з питань розмінування Миколаївщини	https://nikvesti.com/news/314822-poshyrennya-rozminuvannya-v-mykolaivskiy-oblasti-onovleni-dosyagnennya-2025
316868	2026-04-05	До військової частини мобілізували дві тисячі непридатних чоловіків: Міноборони проводять перевірку	https://nikvesti.com/news/316868-dvi-tysyachi-nepriyatnikh-mobilizuvali-do-odniyey-chastini
316875	2026-04-06	Скільки за 2025 рік заробили голова Миколаївської ОВА та його заступники: дані декларацій	https://nikvesti.com/news/316875-posadovtsiv-mykolaivskoi-ova-deklaracii-2025-rik
317096	2026-04-10	Нардеп заявив, що у Південноукраїнську хочуть створити військову адміністрацію	https://nikvesti.com/news/317096-nardep-vid-es-pivdennoukrainsk-viiskovu-administratsiiu
317167	2026-04-13	У Південноукраїнську вже вчетверте не змогли зібратися на сесію	https://nikvesti.com/news/317167-u-pivdennoukrainsku-vchetverte-ne-zmogli-zibratisia-na-sesiiu
317204	2026-04-14	«Тиск на громаду неприпустимий», — Чорноморов виступив проти військової адміністрації у Південноукраїнську	https://nikvesti.com/news/317204-nardepp-chornomorov-vystupyv-proty-stvorennia-viiskovoi-administratsii-u-pivdennoukrainsku
317575	2026-04-23	Символ стійкості: на Миколаївщині розпочали відновлення лісів, знищених під час запеклих боїв за обласний центр	https://nikvesti.com/news/317575-na-mykolaivshchyni-rozpochaly-vidnovlennya-lisiv-znyshchenykh-pid-chas-bojiv-mykolaiv-a
317598	2026-04-24	Південноукраїнська міськрада вп'яте не зібралася на сесію	https://nikvesti.com/news/317598-pivdenno-ukrainska-miskrada-vpyate-ne-zibrasya-na-sesiyu-ua
317715	2026-04-27	Екстремальна аварійна кліматична ситуація, — Фонд держмайна про пиління шламу з МГЗ у Миколаєві	https://nikvesti.com/news/317715-ekstremalna-avariyna-klimatychna-sytuatsiya-fond-derzhmaina-pro-pylinnya-shlamu-z-mgz-u-mykolayevi
317717	2026-04-27	«Визначеність стимулює служити», — омбудсманка закликає до чітких термінів служби	https://nikvesti.com/news/317717-ombudsmanka-zaklykaie-vyznachyty-chitkyi-strokv-sluby-dlia-vijskovykh
317952	2026-05-01	Виплати до 400 тисяч і нові правила служби: Зеленський анонсував реформу армії	https://nikvesti.com/news/317952-zelenskiy-anonsuvav-reformu-armiyi-zminyat-viplati-kontrakty-ta-upravlinnya
318030	2026-05-04	В Україні готують реформу ВЛК і відбір за професіями замість масових повісток	https://nikvesti.com/news/318030-minoboroni-gotuie-zmini-do-vlk-i-mobilizatsii-shcho-planuiut-zminiti
318523	2026-05-15	Криза самоврядування у Південноукраїнську: мер знову виступив за військову адміністрацію	https://nikvesti.com/news/318523-kriza-samovriaduvannia-u-pivdennoukrainsku-mer-znovu-vystupyv-za-viiskovu-administratsiiu
319111	2026-05-29	Кім попросив Зеленського ввести військову адміністрацію у Південноукраїнську	https://nikvesti.com/news/319111-glava-mykolayivskoyi-ova-vitaliy-kim-pryzyv-prezydenta-vvesty-viyskovu-administratsiyu-u-pivdennoukrayinsku
319442	2026-06-06	Військова омбудсманка: 7% усіх мобілізованих мають право на відстрочку	https://nikvesti.com/news/319442-viiskova-ombudsmanka-7-usikh-mobilizovanikh-mayut-pravo-na-vidstrochku
