id	date	title	url
5234	2009-07-30	На Житомирщине разбилась фура с пивом: 37 бочек &laquo;испарилось&raquo; (фото)	https://nikvesti.com/news/5234
743	2009-08-03	В Николаеве даже итальянское масло продают без информации о производителе	https://nikvesti.com/news/743
5650	2009-09-02	В Полтавской области обнаружен сговор врачей	https://nikvesti.com/news/5650
23807	2011-07-27	В ГАИ считают дорогу на границе Николаевской и Херсонской областей — одной из самых опасных дорог Украины	https://nikvesti.com/news/23807
27341	2011-12-06	Назначили начальника отдела по вопросам банкротства ГУ юстиции в Николаевской области	https://nikvesti.com/news/27341
61589	2014-11-18	Рейсовый автобус с 30-ю пассажирами перевернулся на Полтавщине: есть жертвы	https://nikvesti.com/news/61589
75850	2015-09-25	На Николаевщине сухогруз ВМС получил от волонтеров радар с радиусом действия 70 километров	https://nikvesti.com/news/75850
80168	2015-12-17	В Николаевском роддоме №1 впервые выдали свидетельства о рождении ребенка :baby:	https://nikvesti.com/news/80168
86657	2016-04-21	Летом в Николаеве появится бюро правовой помощи	https://nikvesti.com/news/86657
88924	2016-06-06	В Полтавской области кроссовер смял ВАЗ с четырьмя парнями	https://nikvesti.com/news/88924
91684	2016-08-01	В Полтавской области неизвестные взорвали банкомат в здании сельсовета	https://nikvesti.com/news/91684
107056	2017-04-26	Николаевский области нет в планах основных работ Укравтодора на 2017 год	https://nikvesti.com/news/107056
119635	2017-11-16	На трассе Николаев - Кропивницкий планируют капитально отремонтировать 73 километра за 1,6 миллиарда гривен	https://nikvesti.com/news/119635
121417	2017-12-15	Бывшего мэра Торецка выпустили из СИЗО для обмена	https://nikvesti.com/news/121417
124447	2018-02-06	«Укравтодор» отменил выделение 2 миллиардов гривен на автодорогу «Николаев – Кропивницкий»	https://nikvesti.com/news/124447
124494	2018-02-06	Омелян: В 2018 году на дороги в Украине потратят 50 миллиардов	https://nikvesti.com/news/124494
126364	2018-03-06	Кабмин утвердил пять дорожных программ	https://nikvesti.com/news/126364
126382	2018-03-06	Глава Укравтодора: Надеюсь, что в 2018 году начнем ремонт дороги Николаев - Кропивницкий	https://nikvesti.com/news/126382
136825	2018-08-08	Полиция Днепропетровской области открыла уголовное производство по факту утечки азотной кислоты	https://nikvesti.com/news/136825
137657	2018-08-20	В Днепропетровской области фура врезалась в маршрутку, 13 пострадавших	https://nikvesti.com/news/137657
147152	2018-12-17	За 11 месяцев 2018 года 6 тысяч новорожденных получили свидетельство о рождении непосредственно в роддоме	https://nikvesti.com/news/147152
149358	2019-01-18	Гройсман рассказал о строительстве «одной из самых современных дорог» из бетона «Днепр - Решетиловка»	https://nikvesti.com/news/149358
150386	2019-02-01	Омелян: ремонт дороги «Николаев - Кропивницкий» в приоритете «Укравтодора» в этом году	https://nikvesti.com/news/150386
152034	2019-02-21	Глава «Укравтодора» рассказал, что бетонную дорогу «Николаев - Кропивницкий» построят через 2 - 3 года	https://nikvesti.com/news/152034
155961	2019-04-09	«Укравтодор» открыл движение на первой бетонной дороге в Украине	https://nikvesti.com/news/155961
156818	2019-04-20	Первая украинская бетонная дорога имеет 28 лет гарантии, - Омелян	https://nikvesti.com/news/156818
160456	2019-06-10	Николаевское предприятие поставляет цемент для строительства бетонной дороги на Полтавщине	https://nikvesti.com/news/160456
163706	2019-07-22	Ефремова выпустили из СИЗО, в котором он пробыл 3 года	https://nikvesti.com/news/163706
163851	2019-07-24	Укравтодор отремонтировал половину запланированных на этот год дорог — Мининфраструктуры	https://nikvesti.com/news/163851
170687	2019-10-28	Криклий пообещал «уделить внимание» аварийным дорогам Николаевщины – Н-11 и Н-14	https://nikvesti.com/news/170687
172244	2019-11-15	«Мы готовим поправки в закон о рынке земли, чтобы снизить риски», - Герасимов	https://nikvesti.com/news/172244
174133	2019-12-06	В Украине полностью подключены к отоплению 22 области	https://nikvesti.com/news/174133
174536	2019-12-11	В трех областях Украины сохраняются проблемы с отоплением	https://nikvesti.com/news/174536
177328	2020-01-15	Кабмин утвердил перечень дорог, которые восстановят в 2020 году - в список попали николаевские трассы	https://nikvesti.com/news/177328
177332	2020-01-15	На ремонт и строительство дорог в Николаевской области Кабмин планирует выделить более 4 миллиардов гривен	https://nikvesti.com/news/177332
178439	2020-01-27	В 2020 году в Украине планируют отремонтировать 4 тысячи километров дорог, - Гончарук	https://nikvesti.com/news/178439
181919	2020-03-05	Руководителем аппарата Николаевской ОГА стал бывший замначальника областной юстиции	https://nikvesti.com/news/181919
194069	2020-07-23	На Полтавщине террорист отпустил заложника и сбежал в лес	https://nikvesti.com/news/194069
194134	2020-07-24	В полиции заявили, что увеличили территорию поиска полтавского захватчика	https://nikvesti.com/news/194134
194577	2020-07-29	В МВД допускают, что полтавский захватчик мог совершить самоубийство	https://nikvesti.com/news/194577
199419	2020-09-23	Кабмин согласовал кандидатуру на должность первого заместителя главы Николаевской ОГА	https://nikvesti.com/news/199419
201575	2020-10-19	В Украине начало действовать новое деление на карантинные зоны	https://nikvesti.com/news/201575
202303	2020-10-26	В Украине вступили в силу новые карантинные зоны	https://nikvesti.com/news/202303
202402	2020-10-27	Губернатор Николаевщины назначил руководителя аппарата ОГА своим заместителем	https://nikvesti.com/news/202402
203340	2020-11-06	Укравтодор инвестирует более 140 миллиардов в ключевые проекты	https://nikvesti.com/news/203340
204180	2020-11-17	Зеленский уволил Стадника с должности главы Николаевской ОГА	https://nikvesti.com/news/204180
205524	2020-12-02	Глава Николаевской ОГА Ким решил пока оставить только одного заместителя из команды своего предшественника, по остальным думает	https://nikvesti.com/news/205524
206120	2020-12-09	Решетилов останется первым заместителем губернатора Кима, остальные замы – на согласовании Кабмина	https://nikvesti.com/news/206120
206556	2020-12-14	Губернатор Ким получил второй отрицательный тест на COVID-19 и возвращается к работе	https://nikvesti.com/news/206556
206562	2020-12-14	Руководительницей патронатной службы губернатора Николаевщины стала Кукуруза	https://nikvesti.com/news/206562
206618	2020-12-15	Кабмин разрешил Киму назначить своим заместителем чиновника из команды задержанного на взятке губернатора Кировоградщины	https://nikvesti.com/news/206618
207110	2020-12-21	Глава Николаевской ОГА представил первого заместителя и рассказал о своей команде	https://nikvesti.com/news/207110
207112	2020-12-21	«Наши новости читает Киев», - новый губернатор Николаевщины попросил СМИ писать о хорошем	https://nikvesti.com/news/207112
207190	2020-12-22	«Вони мені не потрібні», — голова Миколаївської ОДА пообіцяв відмовитися від надбавок і премій	https://nikvesti.com/news/207190-holova-mykolaivskoyi-oblderzhadministratsiyi-vitaliy-kim-zayavyv-shcho-gotovyy-vidmovytysya-vid-nadbavok-i-premiy-do-svoy
207454	2020-12-24	Кім підписав розпорядження про призначення Кузьміна своїм заступником	https://nikvesti.com/news/207454
208200	2021-01-05	Гранатуров может стать заместителем губернатора Николаевщины Кима	https://nikvesti.com/news/208200
209361	2021-01-19	Губернатор Ким с момента назначения получил почти ₴60 тыс. зарплаты, но без надбавок и премий	https://nikvesti.com/news/209361
209366	2021-01-19	Губернатор Ким назначит своим заместителем главу партии «За Майбутнє» на Николаевщине	https://nikvesti.com/news/209366
210441	2021-01-29	В Николаеве у мемориала Небесной сотни почтили память Героев Крут	https://nikvesti.com/news/210441
210744	2021-02-02	Вице-губернатор Решетилов хочет установить на Николаевщине станции мониторинга воздуха — нужны деньги из госбюджета	https://nikvesti.com/news/210744
210909	2021-02-03	В Николаевской ОГА пояснили, почему не аннулировали разрешение на выбросы у «Экотранса» по требованию экологов	https://nikvesti.com/news/210909
210931	2021-02-03	Депутаты Николаевского облсовета решили обязать ОТГ принять на баланс лесопосадки до конца 2021 года	https://nikvesti.com/news/210931
210935	2021-02-03	Управление Госгеокадастра в Николаевской области будет ликвидировано	https://nikvesti.com/news/210935
211985	2021-02-14	В Николаеве проведут форум для аграриев	https://nikvesti.com/news/211985
213701	2021-03-03	В николаевской «Аграрке» представили программу последипломного обучения	https://nikvesti.com/news/213701
216057	2021-03-30	С улучшением погоды «Большая стройка» стартовала сразу на 215 трассах по всей Украине — среди них и николаевские автодороги	https://nikvesti.com/news/216057
216125	2021-03-31	Необходимо разбираться: В Николаевской ОГА считают, что Госгеокадастр с нарушениями распорядился землей Мигиевской ОТГ	https://nikvesti.com/news/216125
216150	2021-03-31	«Я не сторонник закрытия предприятия», — вице-губернатор Решетилов о заводе «Экотранс» в Николаеве	https://nikvesti.com/news/216150
216153	2021-03-31	Вице-губернатор Решетилов заявил, что в госбюджете-2021 мало денег, а у Николаевщины нет проектов, чтобы их привлечь	https://nikvesti.com/news/216153
216795	2021-04-08	Квартиры, машины, земельные участки: что задекларировало руководство Николаевской ОГА	https://nikvesti.com/news/216795
216935	2021-04-09	В Южный Буг выпустили более 160 тысяч экземпляров рыб	https://nikvesti.com/news/216935
219614	2021-05-13	На Полтавщине столкнулись легковушка и грузовик - погибли двое журналистов	https://nikvesti.com/news/219614
220468	2021-05-24	Конфликт из-за базы отдыха в Коблево: соберут рабочую группу для поиска компромиссов	https://nikvesti.com/news/220468
220911	2021-05-28	На базе Николаевской «аграрки» заработала собственная пекарня	https://nikvesti.com/news/220911
221491	2021-06-05	Коблево проверили на готовность к туристическому сезону	https://nikvesti.com/news/221491
222919	2021-06-23	Исследованием влияния НГЗ на экологию займется рабочая группа при Николаевской ОГА	https://nikvesti.com/news/222919
223774	2021-07-05	Руководство госпредприятия «Степовое» на Николаевщине обещает выплатить долги по зарплатам до конца месяца	https://nikvesti.com/news/223774
223855	2021-07-06	В Николаевской ОГА создали рабочую группу для проверки работы директора аэропорта Барны	https://nikvesti.com/news/223855
224041	2021-07-08	Амбулатории Николаевщины получили 10 новых машин	https://nikvesti.com/news/224041
224082	2021-07-08	Замначальника земельного управления горсовета возглавит экологическое направление в Николаевской ОГА	https://nikvesti.com/news/224082
224128	2021-07-09	Осенью в Николаевской области хотят провести национальный винодельческий форум	https://nikvesti.com/news/224128
225602	2021-07-28	Глава парламента Разумков посетил судостроительный завод «Нибулон» в Николаеве	https://nikvesti.com/news/225602
225617	2021-07-28	«Мне свита не нужна», — Разумков ответил, почему в Николаеве его не сопровождают первые лица	https://nikvesti.com/news/225617
226763	2021-08-11	Николаевская ОГА создала рабочую группу по разработке стратегии адаптации области к изменению климата	https://nikvesti.com/news/226763
227178	2021-08-16	Барна уволился с должности директора Николаевского аэропорта	https://nikvesti.com/news/227178
227742	2021-08-24	30-летие Независимости Украины: в Николаеве проходит фестиваль народного творчества «Folk-toloka»	https://nikvesti.com/news/227742
227783	2021-08-25	Барна, написавший заявление в день визита Зеленского, получил президентский орден	https://nikvesti.com/news/227783
228203	2021-08-30	Депутата Николаевского райсовета Дьяченко наградили знаком отличия главы ОГА	https://nikvesti.com/news/228203
229163	2021-09-10	В Николаевской ОГА заявили, что не могут вмешиваться в планы власти Очакова расширить села на Кинбурне за счет заповедных зон	https://nikvesti.com/news/229163
229191	2021-09-11	Скоро начнется проектирование, — вице-губернатор о расширении трассы М-14 до четырех полос на участке Николаев-Одесса	https://nikvesti.com/news/229191
229238	2021-09-12	В ноябре Николаев посетят виноделы из Бордо	https://nikvesti.com/news/229238
230640	2021-09-29	Депутаты выделили ₴400 тысяч из бюджета области на проведение форума виноделов в Николаеве	https://nikvesti.com/news/230640
231652	2021-10-12	Средняя цена за гектар сельхозземли на Николаевщине —  23 тысячи гривен	https://nikvesti.com/news/231652
232932	2021-10-29	Губернатор Николаевщины Ким объяснил, почему передал медицину Гранатурову: «Он не был загружен, а Кузьмин разрывался»	https://nikvesti.com/news/232932
233316	2021-11-03	Николаевщине бесплатно отдадут мобильную станцию ​​экологического мониторинга за ₴12,5 млн	https://nikvesti.com/news/233316
235937	2021-12-09	Шмыгаль пообещал, что в 2022 году в Украине начнут строить первый автобан	https://nikvesti.com/news/235937
236228	2021-12-13	Вице-губернатор Гранатуров во время годового отчета поблагодарил главу партии «За Майбутнє» за помощь Николаевщине	https://nikvesti.com/news/236228
237154	2021-12-24	Министр инфраструктуры пообещал «большой прорыв» в дорожном строительстве на Николаевщине	https://nikvesti.com/news/237154
239368	2022-01-27	Ежемесячные премии в ₴7 тыс. и матпомощь на ₴40 тыс., — активист рассказал, сколько зарабатывают чиновники Николаевской ОГА	https://nikvesti.com/news/239368
240917	2022-02-16	В 2021 году Служба автодорог Николаевщины использовала 99% денег, выделенных на ремонт дорог	https://nikvesti.com/news/240917
241420	2022-02-22	Ремонт дорог туристических направлений на Николаевщине планируют закончить к началу курортного сезона-2022	https://nikvesti.com/news/241420
244762	2022-03-28	Николаев почтил память освободителей города во Второй мировой войне	https://nikvesti.com/news/244762
244748	2022-03-28	Война РФ против Украины: интенсивность обстрелов Николаева уменьшилась, оккупанты всё ещё в Снигирёвке	https://nikvesti.com/news/244748
246611	2022-04-22	Железнодорожное сообщение с Николаевом возобновлено, — вице-губернатор области	https://nikvesti.com/news/246611
246613	2022-04-22	На данный момент подсчитать невозможно, — вице-губернатор об убытках Николаевщины из-за войны России против Украины	https://nikvesti.com/news/246613
246616	2022-04-22	Разрушенные россиянами больницы Николаевщины после войны восстановят за госсредства, — вице-губернатор	https://nikvesti.com/news/246616
246644	2022-04-22	Жизнь под обстрелами — журналисты показали, как живет село Котлярево на Николаевщине	https://nikvesti.com/news/246644
246590	2022-04-22	Война РФ против Украины: оккупанты снова обстреливали жилые районы Николаева	https://nikvesti.com/news/246590
246665	2022-04-23	ВОЗ зафиксировала по меньшей мере 162 атаки на медучреждения в Украине с момента вторжения РФ	https://nikvesti.com/news/246665
249432	2022-06-03	Николаевские пиротехники получили новый бронированный автомобиль	https://nikvesti.com/news/249432
251487	2022-07-07	Фермер из Шевченково под Николаевом ушел в морпехи после того, как российская армия разрушила его хозяйство	https://nikvesti.com/news/251487
254935	2022-08-28	Зеленський відзначив миколаївців держнагородами та присвоїв звання обласному керівництву СБУ та ДСНС	https://nikvesti.com/news/254935
258423	2022-10-20	«Незабаром у Коблівській громаді з'явиться нова амбулаторія», – депутат Агабеков	https://nikvesti.com/news/258423
261270	2022-12-07	Через війну аграрії Миколаївщини втратили 40% врожаю	https://nikvesti.com/news/261270
261312	2022-12-08	Цієї осені аграрії Миколаївщини скоротили посівні площі зернових на 30-35%	https://nikvesti.com/news/261312
262336	2022-12-29	В 2022 році на Миколаївщині зібрали врожай вдвічі менший за минулорічний	https://nikvesti.com/news/262336
263869	2023-01-26	Американські благодійники передали Миколаївщині пожежний автомобіль	https://nikvesti.com/news/263869
266068	2023-03-07	Українським захисницям вручили нагороди у Миколаєві: «Дякуємо кожній за службу та вірність»	https://nikvesti.com/news/266068
267046	2023-03-26	У Бердянську окупанти видаватимуть перепустки для переміщення, але після проходження «фільтрації» — Генштаб	https://nikvesti.com/news/267046
267708	2023-04-07	«Нам потрібен працюючий бізнес та робочі місця», — Миколаївщину відвідала міністр економіки Свириденко	https://nikvesti.com/news/267708
269683	2023-05-19	Мінкультури готує декілька досьє для внесення до списку ЮНЕСКО	https://nikvesti.com/news/269683
271164	2023-06-15	Попри обіцянки про відкритість Табунщик провів таємну сесію облради, де проголосували за підвищення йому премії та надбавки	https://nikvesti.com/news/271164
271571	2023-06-22	«Не було таких планів», – Кім про те, що його можуть відправити керувати Києвом	https://nikvesti.com/news/271571
271606	2023-06-22	«Є питання до заступників», — нардеп Чорноморов про роботу Миколаївської ОВА	https://nikvesti.com/news/271606
271765	2023-06-26	«Кубок міста-героя»: в Миколаєві пройшов перший з початку повномасштабного вторгнення турнір з самбо	https://nikvesti.com/news/271765
