id	date	title	url
319640	2026-06-11	У Південноукраїнську скликають сесію міськради онлайн: депутати не можуть зібратися з лютого	https://nikvesti.com/news/319640-online-session-south-ukraine-2026
319664	2026-06-12	Депутати самостійно скликають позачергову сесію у Південноукраїнську: місто може втратити грант Данії	https://nikvesti.com/news/319664-deputaty-samostijno-sklikaiut-pozachergovu-sesiiu-u-pivdennoukrainsku-misto-mozhe-vtratiti-grant-danii
319668	2026-06-12	Від доплат до термінів служби: Міноборони найближчими тижнями представить реформу для військових	https://nikvesti.com/news/319668-uryad-hotuye-reformu-viyskovoyi-sluzhbi-shcho-zminitsya
319684	2026-06-12	Депутати не змогли провести сесію міськради у Південноукраїнську: їм не дали доступ до системи голосування та зали	https://nikvesti.com/news/319684-deputaty-ne-zmohly-provesty-sesiiu-miskrady-u-pivdennoukrayinsku-jim-ne-daly-dostup-do-systemy-holosuvannia-ta-zali
319698	2026-06-13	Некомпетентість мера та секретаря міськради, — депутатка про те, з чого почалася криза влади у Південноукраїнську	https://nikvesti.com/news/319698-nekompetentnist-mera-ta-sekretarya-miskradi-deputatka-poyasnila-z-chogo-pochalasya-kriza-vladi-u-pivdennoukrainsku
319790	2026-06-15	У міськраді Південноукраїнська заявили, що мають ще день, щоб залучити €5,2 млн гранту від Данії	https://nikvesti.com/news/319790-pivdennoukrainska-grant-daniia-miskrada-2026
319995	2026-06-19	В Управлінні стратегічних розслідувань у Миколаївській області зʼявився новий керівник	https://nikvesti.com/news/319995-u-khyt-stratehichnykh-rozsliduvan-u-mykolaivskii-oblasti-novyj-kerivnyk
320200	2026-06-24	«Ми хочемо демократії», — Кім взяв участь у перший зборах «молодіжних конгресменів» Миколаївщини	https://nikvesti.com/news/320200-kim-vzyav-uchast-u-pershikh-zborakh-molodizhnogo-kongresu-mikolayivschini
320396	2026-06-29	У Південноукраїнську виконком не підтримав підвищення вартості води та тепла	https://nikvesti.com/news/320396-vikonkom-pivdennoukrainskoi-miskoi-rady-vidkhyliv-pidvyshchennia-taryfiv
320525	2026-07-02	У Південноукраїнську ліквідація Іванівської гімназії може затягнутися ще на рік	https://nikvesti.com/news/320525-reorhanizatsiia-ivanivskoi-himnazii-na-pochatkovu-shkolu
320568	2026-07-02	У Південноукраїнську створили міську військову адміністрацію	https://nikvesti.com/news/320568-ivan-kukhta-golova-pivdennoukrainskoyi-viyskovoyi-administratsiyi-ua
321233	2026-07-16	Зеленський призначив Решетілова виконувачем обов'язків голови Миколаївської ОВА	https://nikvesti.com/news/321233-reshetilov-vikonuvaichem-obovyazkiv-golovi-mykolayivskoyi-ova-2026
321275	2026-07-17	Кім пообіцяв лобіювати інтереси Миколаївщини у держбюджеті: «Підтримка буде більшою»	https://nikvesti.com/news/321275-kim-poobitsiav-lobiuvaty-interesy-mykolaivshchyny-u-derzhbiudzheti-pidtrymka-bude-bilshoyu
321280	2026-07-18	Росіяни атакували Радсадівську та Горохівську громади на Миколаївщині	https://nikvesti.com/news/321280-rosiyani-atakuvali-radsadivsku-ta-gorohivsku-gromadi-na-mykolaivshchini-2026
321289	2026-07-18	Кім: Миколаївщина зміцнила свої позиції в Уряді	https://nikvesti.com/news/321289-kim-mykolaivshchyna-zmitsnyla-svoi-pozytsii-v-uryadi
321290	2026-07-18	«Дзвонив премʼєр, ми розмовляли», — Кім про пропозицію перейти на роботу в Кабмін	https://nikvesti.com/news/321290-dzhonyv-premier-my-rozmovlyaly-kim-pro-propozytsiyu-pereyty-na-robotu-v-kabmin-2026
321291	2026-07-18	Кім назвав Федорова драйвером змін і заявив, що його відставка не пов'язана з популярністю	https://nikvesti.com/news/321291-duzhe-vazhki-rishennia-mizh-poganym-i-duzhe-poganym-kim-pro-zvilnennia-fedorova-z-minoboroni
321294	2026-07-18	Команда Миколаївської ОВА залишається працювати під керівництвом Решетілова, — Кім	https://nikvesti.com/news/321294-komanda-mykolaivskoyi-ova-zalyshayetsya-pratsyuvaty-pid-kerivnytstvom-reshetilova-kim
321305	2026-07-19	«Хочу бути в контексті проблем», — Кім заявив, що після призначення в Уряд не складає мандат депутата Миколаївської міськради	https://nikvesti.com/news/321305-kim-zayavyv-shcho-pislya-pryznachennya-v-uryad-ne-skladaye-mandat-deputata-mykolaivskoyi-miskrady
321309	2026-07-19	30 дітей із Миколаївщини вирушили на відпочинок до Львівської області	https://nikvesti.com/news/321309-ditei-viisjkovikh-iz-mykolaivshchini-na-ozdorovlennia-do-lvivshchini
